{
  "headline": "유동인구는 평균을 크게 웃돌지만 카페 과밀이 변수인 '카공 수요' 상권",
  "grade": "B+",
  "summary": "목동 이 자리는 입지 점수 78.4점으로 상위권에 드는 매물입니다. 일평균 유동인구가 9,200명으로 지역 평균(7,500명)보다 약 23% 많고, 점심(12–13시)과 저녁(18–20시) 두 번의 뚜렷한 피크가 형성되는 전형적인 생활·업무 혼합 상권입니다.\n\n다만 반경 500m 안에 카페가 19곳으로 경쟁이 치열합니다. 단순히 '커피를 파는 가게'로는 묻히기 쉽고, 주변 카페들의 방문자 태그가 '카공하기 좋아요'(412)와 '디저트가 맛있어요'(301)에 강하게 쏠려 있다는 점이 핵심 단서입니다. 즉 이 동네 손님들은 '오래 머무르며 공부·작업하는 공간'과 '디저트'를 기대하고 있습니다.\n\n추정 월매출은 1,850만 원으로 지역 평균 점포(1,500만 원)보다 높게 잡히며, 업종 성장률도 +6.2%로 우호적입니다. 초기 투자금 약 9,500만 원은 현재 추정 수익 기준 약 16개월이면 회수가 가능한 수준입니다. 관건은 카공족 특유의 낮은 회전율을 객단가와 디저트 부착매출로 얼마나 메우느냐입니다.",
  "estimatedRevenue": {
    "monthlyKrw": 18500000,
    "areaAvgKrw": 15000000,
    "vsAreaAvgPct": 23.3,
    "note": "지역 평균 점포 매출 대비 약 23% 높은 추정치. 공공데이터 기반 추정으로 실제와 차이가 있을 수 있습니다."
  },
  "roi": {
    "months": 16.3,
    "initialInvestmentKrw": 95000000,
    "monthlyNetProfitKrw": 5825000,
    "assumptions": [
      "초기 투자금 = 보증금 3,000만 + 권리금 2,000만 + 인테리어·설비 4,500만 원",
      "월 순이익 = 추정매출 − 고정비(월세·관리비·인건비 620만) − 원가(매출의 35%)",
      "인건비는 1.5인 기준 월 380만 원으로 가정"
    ]
  },
  "bep": {
    "peakWindow": "평일 12–13시 점심, 18–20시 저녁",
    "minPeakUnitsPerDay": 26,
    "targetPeakUnitsPerDay": 50,
    "avgTicketPriceKrw": 6500,
    "basis": "영업일 26일·피크 매출비중 45%·객단가 6,500원 가정. 손익분기는 피크 3시간 하루 26잔, 추정매출 달성은 50잔 수준."
  },
  "recommendation": {
    "concept": "장시간 체류형 '카공 카페' + 시그니처 디저트 병행. 단순 테이크아웃보다 좌석 점유 가치를 객단가로 환산하는 구조.",
    "menu": ["콘센트석 전용 세트(커피+디저트)", "수험생·재택근무 타깃 오후 디저트 플레이트", "체류 시간당 부담 낮은 리필/추가 음료"],
    "priceBand": "음료 4,500~6,500원, 디저트 6,000~9,000원 (객단가 6,500원 목표와 정합)",
    "interior": "1인석·콘센트·조용한 존을 전면에. 2층 입지를 '집중 공간'으로 역포지셔닝하고 창가·조도 설계에 투자.",
    "targetCustomer": "인근 학생·수험생, 재택/외근 직장인, 디저트 목적 방문객"
  },
  "competition": {
    "summary": "반경 500m 카페 19곳으로 과밀 상권. 경쟁점 수 8곳은 지역 평균(5곳)보다 많아 차별화 없이는 매몰 위험.",
    "positiveSignals": ["카공하기 좋아요", "디저트가 맛있어요", "주차하기 편해요"],
    "cautions": ["카페 19곳 과밀", "2층 입지로 1층 대비 노출 약함"]
  },
  "risks": [
    { "title": "카페 과밀 경쟁", "detail": "반경 500m 19곳. 컨셉·메뉴 차별화가 없으면 가격 경쟁에 휘말리기 쉽습니다." },
    { "title": "카공족 낮은 회전율", "detail": "장시간 체류 손님 비중이 높으면 좌석당 매출이 떨어집니다. 객단가·디저트 부착매출 설계가 필수입니다." },
    { "title": "2층 입지 접근성", "detail": "1층 대비 진입 노출이 약해 초기 인지도 확보에 마케팅 비용이 더 듭니다." }
  ],
  "opportunities": [
    { "title": "명확한 수요 시그널", "detail": "'카공'·'디저트' 태그가 압도적이라 타깃과 컨셉을 데이터로 정당화할 수 있습니다." },
    { "title": "주차 우위", "detail": "건물 내 주차 7면은 인근 카페 대비 차별점으로, '주차 편해요' 태그 수요와 맞물립니다." },
    { "title": "성장하는 업종", "detail": "업종 성장률 +6.2%로 시장이 위축되지 않는 구간입니다." }
  ],
  "disclaimers": [
    "추정 월매출·유동인구는 공공데이터 기반 추정치이며 실제 영업 결과와 다를 수 있습니다.",
    "원가율 35%, 월 인건비 380만 원, 인테리어·설비 4,500만 원은 업종 표준 가정값입니다.",
    "주변 경쟁점 분석은 네이버 방문자 키워드 태그(사전수집)에 기반하며 리뷰 본문은 포함하지 않았습니다.",
    "본 보고서는 생존 확률을 수치로 단정하지 않으며, 정성적 리스크·기회로 제시합니다."
  ]
}
